{"type":"config","name":"Optimize gzipped bundle size for core, hooks, and compat","metricName":"total_gzip_bytes","metricUnit":"","bestDirection":"lower"}
{"run":1,"commit":"2ecd5a1","metric":31440,"metrics":{},"status":"keep","description":"Baseline: benchmark harness builds core/hooks/compat, sums gzip bytes of shipped CJS/ESM/UMD artifacts, and runs unit tests.","timestamp":1774079608979,"segment":0,"confidence":null}
{"run":2,"commit":"2ecd5a1","metric":31476,"metrics":{},"status":"discard","description":"Tried factoring compat render/hydrate through a shared helper to reduce repeated callback/return logic; compat gzip grew by 36 bytes.","timestamp":1774079739580,"segment":0,"confidence":null}
{"run":3,"commit":"2ecd5a1","metric":31604,"metrics":{},"status":"discard","description":"Tried building compat default export from a hooks namespace plus assign() to avoid listing every hook explicitly; bundle got 164 bytes worse, so explicit shorthand exports compress better.","timestamp":1774079871204,"segment":0,"confidence":null}
{"run":4,"commit":"5025ad3","metric":31372,"metrics":{},"status":"keep","description":"Backported a hooks size optimization: iterate the full hook list in useReducer bailout logic and always return hookState._value. Saved 68 gzip bytes in hooks with tests passing.","timestamp":1774080090914,"segment":0,"confidence":1.3076923076923077}
{"run":5,"commit":"73a301e","metric":31302,"metrics":{},"status":"keep","description":"Backported a compat Suspense size optimization from main: removed a hydration-only vnode.type mutation on unmount and inlined fallback creation. Saved 70 gzip bytes in compat with tests passing.","timestamp":1774080289334,"segment":0,"confidence":2.0294117647058822}
{"run":6,"commit":"c33f30f","metric":31289,"metrics":{},"status":"keep","description":"Replaced process._rerenderCount property accesses in src/component.js with a local rerenderCount variable. Saved 13 gzip bytes in core with tests passing.","timestamp":1774080479987,"segment":0,"confidence":1.735632183908046}
{"run":7,"commit":"c33f30f","metric":31354,"metrics":{},"status":"discard","description":"Tried caching component._parentDom in renderComponent; the extra local increased core gzip by 65 bytes, so the direct property access compresses better here.","timestamp":1774080590696,"segment":0,"confidence":2.157142857142857}
{"run":8,"commit":"d671702","metric":31282,"metrics":{},"status":"keep","description":"Simplified core ref cleanup paths in src/diff/index.js by inlining function-ref unmount checks and flattening the vnode.ref unmount condition. Saved 7 more gzip bytes in core with tests passing.","timestamp":1774080724693,"segment":0,"confidence":2.0927152317880795}
{"run":9,"commit":"bf5f0d3","metric":31273,"metrics":{},"status":"keep","description":"Kept INSERT_VNODE placement state numeric instead of coercing it to boolean in src/diff/children.js. Saved 9 more gzip bytes in core with tests passing.","timestamp":1774080833739,"segment":0,"confidence":2.3194444444444446}
{"run":10,"commit":"bf5f0d3","metric":31273,"metrics":{},"status":"discard","description":"Tried inlining the isMounting check in src/diff/children.js. It was size-neutral after minification, so I discarded it to avoid churn.","timestamp":1774080931756,"segment":0,"confidence":3.3069306930693068}
{"run":11,"commit":"bf5f0d3","metric":31273,"metrics":{},"status":"checks_failed","description":"Tried loosening defaultProps undefined checks in src/create-element.js and src/clone-element.js. Benchmark was unchanged, but createElement tests failed for null props semantics, so this is not safe.","timestamp":1774080990900,"segment":0,"confidence":5.758620689655173}
{"run":12,"commit":"11c54f7","metric":31199,"metrics":{},"status":"keep","description":"Backported the compat render.js optimization to only call toLowerCase() for event props and fold oninput normalization into that branch. Saved 74 gzip bytes in compat with tests passing.","timestamp":1774081133331,"segment":0,"confidence":5.950617283950617}
{"run":13,"commit":"75bf4bd","metric":31175,"metrics":{},"status":"keep","description":"Replaced the handwritten core assign helper in src/util.js with Object.assign. Saved 24 gzip bytes in core with tests passing.","timestamp":1774081253610,"segment":0,"confidence":4.076923076923077}
{"run":14,"commit":"2988015","metric":31170,"metrics":{},"status":"keep","description":"Replaced the handwritten compat assign helper in compat/src/util.js with Object.assign. Saved 5 gzip bytes in compat with tests passing.","timestamp":1774081364340,"segment":0,"confidence":3.4838709677419355}
{"run":15,"commit":"e7b5a47","metric":31160,"metrics":{},"status":"keep","description":"Collapsed nested assign() calls to a single Object.assign-style call in src/diff/index.js after switching core assign to Object.assign. Saved 10 gzip bytes in core with tests passing.","timestamp":1774081486616,"segment":0,"confidence":3.3734939759036147}
{"run":16,"commit":"e7b5a47","metric":31154,"metrics":{},"status":"checks_failed","description":"Tried removing the pre-reset of oldVNode in constructNewChildrenArray. It improved gzip by 6 bytes but broke keyed growing-list diffing, so it is not safe.","timestamp":1774081677809,"segment":0,"confidence":3.2369942196531793}
